{
  "kind": "unit",
  "id": "aerial-watcher",
  "physics_version": "1.0",
  "name": "Watcher",
  "faction": "neutral",
  "description": "A light reconnaissance drone available to any faction. Fixed-wing, long endurance, designed for surveillance. Carries no weapons. Refuels at any airbase or carrier. Fuel-bounded operating radius gives this aircraft real logistics teeth.",
  "designer": "STARTER_KIT",
  "chassis": {
    "chassis_class": "air_fixed_wing",
    "mass_kg": 850,
    "engine_kW": 95,
    "drivetrain_efficiency": 0.78,
    "energy_source": "fuel_cell",
    "fuel_capacity_MJ": 480,
    "fuel_consumption_rate_MJs": 1.8,
    "solar_collection_area_m2": 4,
    "armor_thickness_mm": 8,
    "armor_material": "alloy_composite",
    "hardpoint_count": 2,
    "compatibility_tags": ["all_weather", "stealth_hull"],
    "thermal_capacity_MJ": 40
  },
  "parts": [
    {
      "id": "high-altitude-camera",
      "category": "sensor",
      "name": "High-Altitude Optical Suite",
      "mass_kg": 60,
      "power_draw_kW": 4,
      "sensor_modality": "visual",
      "sensor_range_m": 12000,
      "sensor_sensitivity": 1.3,
      "sensor_active": false
    },
    {
      "id": "telemetry-uplink",
      "category": "communications",
      "name": "High-Bandwidth Uplink",
      "mass_kg": 22,
      "power_draw_kW": 6,
      "communications_type": "radio",
      "communications_range_m": 30000
    }
  ],
  "costs": {
    "scrap": 60,
    "alloy": 25,
    "fuel": 45,
    "power": 8
  },
  "build_time_seconds": 70,
  "tags": ["starter", "tier_1", "recon", "aircraft", "neutral"]
}
